{
  "id": "sample-advisor-1",
  "ts": "2026-07-04T05:00:30Z",
  "kind": "advisor_verdict",
  "cage_id": "outer-cage.01",
  "policy_hash": "a1b2c3d4e5f60718293a4b5c6d7e8f90",
  "source": {
    "type": "advisor",
    "ref": "advisor://verdict/1"
  },
  "advisor_verdict": "HOLD",
  "note": "advisor holds pending founder decision; caged evidence only"
}
