{
  "id": "sample-mock-served-1",
  "ts": "2026-07-04T05:00:15Z",
  "kind": "mock_served",
  "cage_id": "outer-cage.01",
  "policy_hash": "a1b2c3d4e5f60718293a4b5c6d7e8f90",
  "source": {
    "type": "mock",
    "ref": "mock://outer-cage.01/send/ok-stub",
    "detail": "mock stands in for a live call; proves wiring only, never a real outcome"
  },
  "mock_responses": [
    { "for_action_class": "send", "shape": "ok-stub", "content_hash": "deadbeefcafef00d1122334455667788" }
  ]
}
